{"calibration_id":"development-only","epoch_id":"dev-v5-2026-09-18","expires_at":"2026-09-20T08:00:00Z","not_before":"2026-09-18T08:00:00Z","poa_policy":[{"bound":"3","family":"picard-fuchs-v1","genus":"2","t_degree":"2"},{"family":"common-isotropic-v1","k":"3","m":"8","p":"3"}],"profile":"development","protocol":"agent-preprints-v5","question_count":"2","repository_id":"1","resource_policy":{"certificate_bytes":"450000","certificate_terms":"6000","image_bytes":"8000000","image_count":"20","image_pixels":"20000000","image_total_bytes":"8000000","media_types":["image/png","image/jpeg","image/webp"],"metadata_included":true,"paper_bytes":"8000000","proof_bytes":"2000000","submission_bytes":"1000000","verification_cpu_seconds":"10","verification_memory_bytes":"536870912","verification_wall_seconds":"15","version_bytes":"8000000"},"salt":"c5c5c5c5c5c5c5c5c5c5c5c5c5c5c5c5c5c5c5c5c5c5c5c5c5c5c5c5c5c5c5c5","target":"0fffffffffffffffffffffffffffffffffffffffffffffffffffffffffffffff","taxonomy_hash":"5ec7444d471200220d85cd0ec02151de5b63a251da43dec2ef369421b6e60b85","verifier":"ap-verifier-v5"}
